Date,Views,Watch time (hours),Average view duration,Estimated revenue (USD),Video title,Video publish time,Duration,Video views,Watch time (hours)
6/1/24,201287,44363.0054,0:13:13,1121.078,Her Diary Leads to Bust - Border Security Australia,15-Aug-24,1385,111294,27399.4936
5/31/24,189969,44066.438,0:13:55,1253.844,"Airport Drama: Suspicion, Secrets, and Smuggled Snacks | Border Security: Australia's Front Line",8-Oct-23,1321,111294,27838.5361
5/30/24,215311,45301.1884,0:12:37,1372.901,Sea Rescue! | Coast Guard Alaska | Full Episodes,27-Jun-20,2553,110416,31787.406
5/29/24,235058,49235.9453,0:12:34,1545.891,27000 dollars worth of cigarettes - Border Security Australia,18-Jul-24,1406,109920,26469.0245
5/28/24,255406,53188.4191,0:12:29,1262.561,Rotten Surprises Revealed | Border Security: Australia's Front Line,14-Mar-24,1371,108840,26024.8287
5/27/24,311931,59471.4055,0:11:26,1581.348,American Suspected of Smuggling | Border Security: Australia's Front Line,26-Sep-22,1436,108405,28308.6276
5/26/24,243197,41536.8015,0:10:14,1171.075,Banned for Three Years! Border Security Australia,8-Jul-24,1406,108233,24634.1336
5/25/24,245301,38020.6726,0:09:17,1148.978,Breaking The Landspeed World Record at Over 400mph! | Full Length Documentary,27-May-18,2978,107943,35002.2889
5/24/24,294537,39903.27,0:08:07,1323.284,Interrogating Brits over Booze and Pills | Border Security: Australia's Front Line,1-May-24,1361,107785,24730.8955
5/23/24,294248,41595.9293,0:08:28,1354.546,The Real Inglorious Basterds! | True Story of the Jewish Commandos Who Inspired Tarantino | Full Doc,18-Oct-20,3093,107410,21431.7698
5/22/24,326876,41465.7201,0:07:36,1322.218,Hidden Ecstasy Stash Uncovered | Border Security: Australia's Front Line,10-Sep-22,1335,104847,21829.2227
5/21/24,398375,45386.8163,0:06:50,1485.575,Massive Meth Bust - Border Security Australia,23-Aug-24,1371,104556,23756.3549
5/20/24,416076,41570.3705,0:05:59,1286.529,Customs Officer Gets Tough on a Kiwi | Border Security: Australia's Front Line,9-Apr-23,1385,102591,25510.1757
5/19/24,287490,40583.1944,0:08:28,1200.475,Agents Investigate a Suspicious Techie | Border Security: Canada's Front Line,6-Apr-22,1311,101664,22535.7216
5/18/24,289629,38328.8412,0:07:56,1174.371,Cocaine Smuggling Surfer | Border Security: Australia's Front Line,27-Jul-22,1405,101554,26835.4056
5/17/24,315817,38985.1627,0:07:24,1312.888,American Loses Patience w/ Australia Border Patrol | Border Security: Australia's Front Line,24-Sep-23,1281,100879,23357.7659
5/16/24,344709,42855.0957,0:07:27,1445.567,Big Bag of Counterfeit Cash - Border Security Australia,22-Sep-24,5455,100809,40555.5922
5/15/24,337005,40637.7383,0:07:14,1299.816,Desperate to Enter the Country | Border Security: Australia's Front Line,21-May-23,1366,98841,27261.5467
5/14/24,416546,44385.2469,0:06:23,1310.927,Fastest Bike in the World! | Breaking the Land Speed Record! | ACK ATTACK | Full Length Documentary,7-Nov-19,3008,98198,19004.1563
5/13/24,450329,47948.9293,0:06:23,1344.6,UK Border Force | Illegal Immigrants Hidden in a Truck! | Season 2 Episode 7 - Full Episode,17-Apr-21,2700,97738,44596.4438
5/12/24,513081,42164.108,0:04:55,1214.726,Internet Romance Meet-Up: American's Suspicious Visit | Border Security: Australia's Front Line,21-Apr-24,1395,97263,24196.281
5/11/24,399035,37633.7763,0:05:39,1132.088,Caught Red Handed! | NightGuard Security Season 1 Episode 3 | Full Episode,6-Nov-20,2342,96184,28696.8196
5/10/24,483273,38884.8674,0:04:49,1342.127,Criminal Past Catches Up With Man at the Border | Border Security: Australia's Front Line,13-Aug-23,1406,93040,26329.7466
5/9/24,569588,42383.8565,0:04:27,1414.694,Springsteen-Loving Drifter | Border Security: Australia's Front Line,22-Oct-23,1325,91324,25045.0353
5/8/24,558584,37948.1129,0:04:04,1218.462,Overstayed Visa by 14 Years! | Border Security: Canada's Front Line,21-Nov-22,1306,90739,18093.114
5/7/24,594031,39328.0632,0:03:58,1250.675,Coast Guard Florida | Season 1 - Episode 1 Premiere! | Full Episode,10-Aug-20,2553,90571,22642.6861
5/6/24,854015,46238.8881,0:03:14,1408.406,Customs Agents Find Smuggled Drugs | UK Border Patrol,7-Nov-19,1382,90463,20971.3878
5/5/24,671506,54531.2148,0:04:52,1564.77,Undocumented Worker Raid | Border Security: Australia's Front Line,25-Jun-23,1391,89107,24442.3964
5/4/24,506942,40634.6046,0:04:48,1116.813,Thai Masseuse's Vacation Lie | Border Security: Australia's Front Line,25-Oct-23,1341,88998,19986.7762
5/3/24,424672,39500.8889,0:05:34,1246.169,DJ Caught With Cocaine Residue | Border Security: Australia's Front Line,2-Jul-23,1376,88080,24174.4642
5/2/24,420354,43425.8526,0:06:11,1351.507,Drugs Disguised as Baby Formula | Border Security: Canada's Front Line,8-Apr-22,1311,87855,21483.9837
5/1/24,363519,49114.641,0:08:06,1521.229,Gambler's Blues - Border Patrol on DangerTV | Border Security: Australia's Front Line,25-Jun-24,1406,87043,19748.4889
4/30/24,320575,42120.983,0:07:53,1365.997,Heroin Smuggled as Incense | Border Security: Australia's Front Line,2-Oct-22,1336,86113,19949.3724
4/29/24,301258,46257.2723,0:09:12,1548.829,Boxes and Boxes of Busts - Border Security Live,29-Aug-24,8150,85666,85494.0124
4/28/24,327983,56480.9199,0:10:19,1748.368,Border Patrol Agents Make Startling Discovery | Locked Up Abroad!,7-Nov-19,1388,84693,15779.6778
4/27/24,304540,45469.7406,0:08:57,1393.757,Lord of the Drug Rings | Border Security: Australia's Front Line,26-Jun-22,1296,84623,18105.4918
4/26/24,311094,46151.3077,0:08:54,1639.661,Wrestler's Visa Woes Down Under | Border Security: Australia's Front Line,11-Oct-23,1325,84540,22677.5054
4/25/24,393638,57186.8595,0:08:43,2020.621,Clash at the Border: Unruly Traveler vs. Customs Officer | Border Security: Australia's Front Line,16-Jul-23,1276,83949,18427.727
4/24/24,365794,45695.7656,0:07:29,1510.578,Coast Guard Florida | Season 1 Finale! | Full Episode,31-Aug-20,2553,83508,24699.6653
4/23/24,409979,45059,0:06:35,1515.058,Big Surprise! | NightGuard Security Season 1 Episode 4 | Full Episode,11-Nov-20,2463,83157,18347.7411
4/22/24,378334,43896.5581,0:06:57,1430.445,Agents Discover Stolen Land Rovers | Border Security: Canada's Front Line,25-Nov-22,1306,83100,18800.1022
4/21/24,451691,51719.4947,0:06:52,1557.447,Lightning Raids - Search Warrant Blitz | Miami SWAT,4-Jun-23,2676,82600,18879.3154
4/20/24,401910,41504.2185,0:06:11,1264.504,Smuggling into the Weekend - Border Security Australia - DangerTV,20-Sep-24,5432,82515,48852.2123
4/19/24,445802,45728.9495,0:06:09,1559.19,UK Border Force | Illegal Workers in Southampton | Season 2 Episode 5 - Full Episode,14-Apr-21,2650,82104,37945.1554
4/18/24,490213,50203.6072,0:06:08,1722.206,Rescuing a Woman in Labor! | Coast Guard Alaska | Full Episode,13-Jun-20,2553,80064,28348.7489
4/17/24,455333,43585.3274,0:05:44,1484.693,Airport Dogs Uncover Cocaine Smuggling | Border Security: Australia's Front Line,30-Nov-23,1385,79481,14861.8407
4/16/24,432876,48358.7544,0:06:42,1726.624,Endless Drug Paraphernalia - Border Security Australia,25-Sep-24,1390,79013,15557.9125
4/15/24,397357,49744.3234,0:07:30,1971.294,Never Hand Over Your Phone to Border Security | Border Security: Australia's Front Line,5-Jun-24,1316,78830,16455.1695
4/14/24,397805,59926.4409,0:09:02,2252.029,Traveler Suspected of Flying to Canada to Illegally Enter US | Border Security: Canada's Front Line,6-Jun-22,1301,78179,16053.4609
4/13/24,365644,42578.9075,0:06:59,1484.897,Severe Weather Rescue | Coast Guard Alaska | Full Episode,15-Jul-20,2554,77558,23892.4849
4/12/24,359576,44381.0021,0:07:24,1723.882,Fighting High Seas! | Coast Guard Alaska | Full Episode,20-Jun-20,2553,76877,25852.4894
4/11/24,379702,48868.1486,0:07:43,1791.385,Cocaine Soup | Border Security: Australia's Front Line,16-Jul-22,1346,76862,18166.9855
4/10/24,360629,42917.7017,0:07:08,1506.751,Mooncakes and Drug Dogs - Border Security: Australia's Front Line,13-May-24,1416,76516,13388.7152
4/9/24,452147,45307.2668,0:06:00,1586.349,MMA Fighter's Frequent Visits Spark Suspicion | Border Security: Australia's Front Line,21-Mar-24,1278,76411,17886.26
4/8/24,493747,45106.6924,0:05:28,1588.589,Coast Guard Alaska | Season 1 Episode 1 Premier | Full Episode,30-May-20,2553,76343,18598.229
4/7/24,533046,54228.6616,0:06:06,1719.059,Undeclared | Border Security: Canada's Front Line,27-Nov-22,1306,75492,18144.9741
4/6/24,461005,44531.7592,0:05:47,1429.526,Jersey Girl | Border Security: Canada's Front Line,4-Nov-22,1306,75168,15014.2957
4/5/24,514871,46137.5488,0:05:22,1593.311,Border Security Finds Big Game | Border Security: Australia's Front Line,18-Apr-24,1491,74419,20714.2848
4/4/24,517014,54018.3482,0:06:16,1832.556,"Giant German ""Guido"" Stopped at Customs | Border Security: Australia's Front Line",27-Aug-23,1385,74056,19236.1267
4/3/24,483247,44417.2459,0:05:30,1453.894,Inadvertent Drug Mule | Border Security: Canada's Front Line,15-Apr-22,1301,73297,16108.6693
4/2/24,449640,46786.5054,0:06:14,1526.704,Stopped at Border in Stolen Car | Border Security: Canada's Front Line,24-Apr-22,1301,73240,16098.3065
4/1/24,426328,44903.3215,0:06:19,1410.695,Traveler Pushes His Luck w/ Border Patrol #publicfreakout #travel #airport,1-Feb-23,60,71848,1120.2794
3/31/24,415838,48888.9923,0:07:03,1698.912,Search Dog Helps the Coast Guard find a Missing Girl! | Coast Guard Alaska | Full Episode,27-Jun-20,2553,71609,24280.3945
3/30/24,334849,42919.9687,0:07:41,1567.278,Lost in the Water Rescue! | Coast Guard Alaska | Full Episode,7-Aug-20,2554,70847,26284.107
3/29/24,276566,42505.993,0:09:13,1751.132,Busted for Cigarettes - Border Security Australia,23-Jul-24,1426,70747,15072.9582
3/28/24,280081,49287.605,0:10:33,1987.977,Cash Stash | Border Security: Australia's Front Line,1-Aug-22,1406,70580,19182.903
3/27/24,225191,40747.8652,0:10:51,1489.92,Solid Gold Bar Raises Suspicion | Border Security: Canada's Front Line,18-May-22,1296,70524,15591.6266
3/26/24,239476,42918.7614,0:10:45,1606.445,Heavily Armed Texan Stopped by Border Patrol | Border Security: Canada's Front Line,18-Mar-22,1311,70480,13254.9543
3/25/24,232752,42749.5424,0:11:01,1589.017,Rock Singer Denied Entry - Border Security Australia,9-Aug-24,1406,70268,15216.0131
3/24/24,262818,53874.7825,0:12:17,1891.562,Smuggling Prescription Pills | Border Security: Australia's Front Line,16-Oct-22,1301,70109,18027.3764
3/23/24,195003,36797.1043,0:11:19,1304.632,Party Boy's Luggage: Vitamins or Trouble? | Border Security: Australia's Front Line,13-Oct-23,1351,69835,18581.7153
3/22/24,180468,37131.8149,0:12:20,1462.74,Stuffy Conceals Coke | Border Security: Australia's Front Line,16-Sep-22,1330,69757,16664.1666
3/21/24,207391,44310.6799,0:12:49,1719.515,Saving Tsunami-Wrecked Vessel | The Salvage Masters,19-May-23,2645,69616,9945.234
3/20/24,189712,39636.4612,0:12:32,1496.71,Manic American Has Nothing to Declare - Border Security Australia,29-Aug-24,1385,68694,16273.053
3/19/24,199592,42046.281,0:12:38,1529.578,Armed Man Knows His Rights | Border Security: Canada's Front Line,17-Dec-22,1316,68406,13378.0913
3/18/24,197212,43655.2392,0:13:16,1617.142,Broke American Tries to Enter Australia | Border Security: Australia's Front Line,10-Aug-22,1390,67045,18027.4579
3/17/24,222884,50649.3096,0:13:38,1721.025,Bags Full of Illegal Drugs | Border Security: Australia's Front Line,20-Jun-24,1311,66626,13439.3593
3/16/24,168932,36468.4613,0:12:57,1223.788,UK Border Security Force Customs Agents Behind the Scenes | Locked Up Abroad | Border Patrol,7-Nov-19,2637,66480,20945.2064
3/15/24,182524,39820.3177,0:13:05,1433.035,Helicopters to the Rescue! | Coast Guard Alaska | Full Episode,20-Jun-20,2554,65869,20535.6297
3/14/24,204539,44127.4562,0:12:56,1572.684,Woman surprised that drugs are illegal ... Border Security Australia,25-Sep-24,5595,65842,32373.9428
3/13/24,175639,38671.5179,0:13:12,1348.538,Potential Sex Worker Interrogated | Border Security: Canada's Front Line,29-Oct-22,1306,65557,14069.9367
3/12/24,192306,42338.004,0:13:12,1441.096,Coast Guard Cape Disappointment Pacific NorthWest | Season 1 - Episode 1 | Full Episode,2-Sep-20,2553,65379,18271.7658
3/11/24,218608,47982.2564,0:13:10,1618.513,Death Row Dogs | Full Length Documentary,7-Nov-19,2667,65103,12107.0999
3/10/24,261911,58100.4213,0:13:18,1809.413,Sea Cucumbers and Meth Markers | Border Security Australia,10-Jun-24,1336,64950,13804.9176
3/9/24,196722,41814.7158,0:12:45,1277.856,Live Border Security Marathon! Five Huge Episodes!!,21-Jun-24,7889,64629,46157.9212
3/8/24,204076,43689.1173,0:12:50,1573.149,Massive Meth Concealment - Border Security Australia,10-Sep-24,1390,64579,14510.3106
3/7/24,239739,51000.4038,0:12:45,1819.85,A Six Figure Fine for Illegal Immigration - Friday Border Binge,25-Oct-24,5543,64058,29324.2949
3/6/24,202588,43752.3873,0:12:57,1426.426,Missing Boat Search & Rescue! | Coast Guard Alaska | Full Episode,13-Jun-20,2553,63821,24471.9337
3/5/24,210796,46817.5056,0:13:19,1520.682,Just a Man and His Teddy Bear? | Border Security: Australia's Front Line,15-Aug-22,1390,63560,16555.3932
3/4/24,223672,48939.8005,0:13:07,1617.025,Stacks of Cash With No Story | Border Security: Australia's Front Line,24-Aug-22,1390,63385,12068.6633
3/3/24,273762,60041.3479,0:13:09,1844.359,Tropical Storm Isaac Rescues! | Coast Guard Florida | Full Episode,17-Aug-20,2554,63349,21609.1342
3/2/24,224882,47441.4933,0:12:39,1428.517,Laptop or Bottom? - Border Security Australia,29-May-24,1381,63183,13037.4707
3/1/24,233054,49263.8465,0:12:40,1655.697,Massive Bust of Hidden Drugs - Border Security Australia,19-Aug-24,1281,63138,13461.8035
2/29/24,275052,58716.5724,0:12:48,2111.072,Bonus Monday Night Live Stream - Australia Border Security Strikes Again,1-Oct-24,5457,62890,35382.6589
2/28/24,261965,57120.0983,0:13:04,1953.537,Fighting Huge Waves - Rescue | Coast Guard Cape Disappointment Pacific Northwest | Full Episode,19-Sep-20,2553,62094,16055.5951
2/27/24,262576,56386.6349,0:12:53,1872.278,Suspicious Drunk Englishman | Border Security: Australia's Front Line,12-Mar-23,1237,61992,15237.1361
2/26/24,255527,54736.0833,0:12:51,1836.852,Man With Strange Past Stopped by Customs | Border Security: Canada's Front Line,20-Apr-22,1301,61919,13477.4659
2/25/24,271933,57615.4952,0:12:42,1744.679,UK Border Force Bust a Criminal | Royal Scam | Season 2 Episode 1 - Full Episode,9-Apr-21,2691,61210,26120.116
2/24/24,295416,63052.2334,0:12:48,2015.992,Cartel Busted - Border Security Australia,13-Aug-24,1395,60662,13030.7827
2/23/24,281766,58509.1839,0:12:27,2070.314,Escort or Girlfriend? - Border Security Australia,1-Nov-24,1371,60305,14714.9251
2/22/24,321532,67707.3998,0:12:38,2343.87,Ship Wreck! | Coast Guard Alaska | Full Episode,11-Jul-20,2553,59741,20765.8688
2/21/24,317957,65217.9441,0:12:18,2185.586,Real Life Batman | Border Security: Canada's Front Line,2-Nov-22,1306,59547,12293.6623
2/20/24,315305,65772.3302,0:12:30,2191.689,Busted for Cream Cheese? Border Security Canada,27-Sep-24,5260,59015,35661.6281
2/19/24,317572,66248.7348,0:12:30,2077.321,Farm Raid - Border Security Australia,5-Aug-24,1381,58394,11213.4823
2/18/24,314451,67211.2117,0:12:49,2026.626,No English - Border Patrol Binge,10-Oct-24,5406,58022,32166.1196
2/17/24,354377,74496.9515,0:12:36,2384.867,Money Launderer Stopped at Border | Border Security: Canada's Front Line,30-Apr-22,1301,57945,12671.9641
2/16/24,276260,54196.7864,0:11:46,1869.54,Stake Out! | NightGuard Security Season 1 Episode 9 | Full Episode,2-Dec-20,2731,57565,22061.5401
2/15/24,309112,62353.8062,0:12:06,2176.248,"Busted For 100,000 Dollar Boots - Border Security Canada",30-Sep-24,5405,57473,27602.0451
2/14/24,265980,49704.9887,0:11:12,1678.5,Customs Break up a Drug Ring | Border Security: Australia's Front Line,23-Apr-23,1381,57245,15159.2766
2/13/24,300508,54230.9241,0:10:49,1730.304,Chopper Rescue! | Coast Guard Alaska | Full Episode,30-May-20,2553,56818,20216.0976
2/12/24,335341,59751.2716,0:10:41,1969.89,Drugs Onboard | Border Security: Australia's Front Line,29-Jun-22,1406,56605,15841.4478
2/11/24,395500,65434.5679,0:09:55,2183.663,That's Not Food in My Country - Border Security Binge!,22-Oct-24,5467,56172,32672.3861
2/10/24,468806,75665.5034,0:09:41,2407.093,Border Patrol Stops Tylenol Haul #borderpatrol #immigration #bordersecurity,31-Jan-24,21,55785,359.0846
2/9/24,472325,67211.807,0:08:32,2253.367,Booted from the Border - Border Security Australia,7-Aug-24,1395,55665,12549.3274
2/8/24,557058,75139.3107,0:08:05,2441.554,Major Drug Bust Stopped - Border Security Australia,26-Aug-24,1381,55462,12792.4948
2/7/24,492973,65060.6569,0:07:55,1964.598,Hunt for Undocumented Workers | Border Security: Australia's Front Line,22-Sep-23,1381,55454,14469.5236
2/6/24,460548,65462.2288,0:08:31,1976.775,You can't escape Border Security,31-May-24,4087,55181,28389.3063
2/5/24,553532,72704.643,0:07:52,2155.981,Illegal King Cobra Skin | Border Security: Australia's Front Line,19-Aug-22,1345,55028,14233.8341
2/4/24,632119,80235.2074,0:07:36,2076.922,Suspicious Russian at the Border | Border Security: Canada's Front Line,10-Apr-22,1311,54950,13676.8938
2/3/24,701181,83091.4839,0:07:06,2318.899,Stopped by Customs for Being Broke? | Border Security: Australia's Front Line,24-Sep-22,1325,54866,13867.2754
2/2/24,565357,75083.8856,0:07:58,2346.182,Fire on Boat Rescue! | Coast Guard Florida | Full Episode,12-Aug-20,2553,54546,17605.1573
2/1/24,615664,88124.1864,0:08:35,2723.361,So.Much.Food | Border Security Australia,15-Jul-24,1265,54534,10067.9874
1/31/24,616857,71674.6,0:06:58,2423.839,American Deemed Too Sick to Enter Canada | Border Security: Canada's Front Line,13-Apr-22,1311,54174,12308.7109
1/30/24,620267,71532.8018,0:06:55,2373.08,Distress Signals - Border Security Australia,27-Oct-24,1356,53763,11587.8009
1/29/24,575993,74725.8035,0:07:47,2370.793,Kiwi With a Checkered Past | Border Security: Australia's Front Line,20-Sep-23,1346,53679,14371.7404
1/28/24,612521,79355.4395,0:07:46,2452.636,Romanian Boxer Stopped By Customs | Border Security: Australia's Front Line,24-Jul-22,1520,53636,16181.1026
1/27/24,556749,84774.4488,0:09:08,2624.128,Stranded Vessel Rescue! | Coast Guard Alaska | Full Episode,20-Jun-20,2553,53351,19216.251
1/26/24,452628,68189.8087,0:09:02,2399.595,Kid's Book Conceals Contraband - Border Security Australia,31-Aug-24,1330,52566,12008.3448
1/25/24,541104,85470.6976,0:09:28,2943.596,UK Border Force | Interpol Suspects! | Season 2 Episode 8 - Full Episode,18-Apr-21,2665,51973,22734.3614
1/24/24,395861,61345.4939,0:09:17,1949.415,Border Security Marathon - Arrests Everywhere,10-Sep-24,6551,50794,33299.0411
1/23/24,401504,61502.1549,0:09:11,1954.598,Four Episodes Back to Back! - Border Security Australia - DangerTV,21-Sep-24,5470,50773,34207.5804
1/22/24,295820,50519.9518,0:10:14,1572.463,Helicopter Search - Lost Kayakers! | Coast Guard Alaska | Full Episode,17-Jul-20,2553,50644,21130.8568
1/21/24,304431,50514.6917,0:09:57,1485.731,UK Border Force Bust Illegals from Iraq | Season 2 Episode 2 - Full Episode,10-Apr-21,2700,50463,20735.5489
1/20/24,316514,57708.1987,0:10:56,1760.232,Strange Last Minute Traveler | Border Security: Canada's Front Line,16-Nov-22,1301,50364,12308.9746
1/19/24,274917,50488.5635,0:11:01,1677.137,Who is She Really? - Border Security Australia,5-Sep-24,1351,50345,11490.8021
1/18/24,298181,57786.4223,0:11:37,1913.213,Seconds to Save Sinking Ship! | Coast Guard Florida | Full Episode,21-Aug-20,2553,50172,15907.6327
1/17/24,247890,45794.5839,0:11:05,1396.419,Friday's Big Border Busts - Border Security Australia,2-Aug-24,8540,49978,25141.6567
1/16/24,270505,47830.5759,0:10:36,1429.316,Are They Smuggling People - Border Security Australia - DangerTV,21-Sep-24,1325,49834,10274.1737
1/15/24,277487,48043.639,0:10:23,1454.011,Mountain Biker Rejected at the Border | Border Security: Canada's Front Line,29-May-22,1301,49810,11332.9476
1/14/24,301163,51883.784,0:10:20,1556.16,Frozen Fisherman Rescue | Coast Guard Alaska | Full Episode,11-Jul-20,2553,49601,18003.7712
1/13/24,330648,56540.1668,0:10:15,1734.979,Psychic Security - Border Security Australia,29-Oct-24,1336,49254,11416.8504
1/12/24,315787,50799.3032,0:09:39,1561.483,Four Huge Border Canada Episodes - Canada Livestream!,20-Jul-24,5186,49195,27354.7861
1/11/24,365836,55965.0156,0:09:10,1718.648,Emotional Baggage | Border Security: Australia's Front Line,24-May-24,1421,47687,9201.1378
1/10/24,350796,48997.4899,0:08:22,1420.059,Border Patrol busts cocaine smuggler who hides drugs in art #borderpatrol #bordersecurity #border,30-Jan-24,50,47151,569.7339
1/9/24,354251,53290.0806,0:09:01,1507.203,"Yeah, We Test for That - Border Security Australia",15-Sep-24,1381,46161,10798.6174
1/8/24,387947,55577.1648,0:08:35,1597.456,Broken Neck Rescue! | Coast Guard Alaska | Full Episode,8-Aug-20,2554,46106,18460.5122
1/7/24,427944,63232.1674,0:08:51,1606.176,Time To Go Home - Border Lunch Broadcast,11-Oct-24,5645,45938,32731.8312
1/6/24,474261,73485.9709,0:09:17,2445.674,Agents Question Soldier on the Run | Border Security: Canada's Front Line,25-Apr-22,1291,45898,10255.4675
1/5/24,440290,63049.3248,0:08:35,1766.487,Border Security Australia rips open chip bags looking for drugs #bordersecurity,28-Apr-24,38,45605,377.377
1/4/24,453234,72034.1915,0:09:32,2063.856,American Partiers Questioned | Border Security: Canada's Front Line,11-Nov-22,1311,45450,11041.656
1/3/24,489468,63157.5395,0:07:44,1681.917,Severed Hand Rescue! | Coast Guard Alaska | Full Episode,1-Aug-20,2554,44857,17882.7719
1/2/24,532525,65133.0834,0:07:20,1612.04,Meth-od Man - Border Security Australia,17-Sep-24,1356,44615,9711.2356
1/1/24,680532,64193.069,0:05:39,1349.25,Big Bust! | NightGuard Security Season 1 Episode 7 | Full Episode,25-Nov-20,2524,44453,13458.1099
12/31/23,564467,54169.1016,0:05:45,1499.225,Rough Seas Rescue off the Coast of Miami | Coast Guard Florida | Full Episode,29-Aug-20,2553,44307,13006.7578
12/30/23,672764,63186.5502,0:05:38,1914.222,Meth Cook? - Border Security Australia | DangerTV,17-Nov-24,1366,44254,8530.6975
12/29/23,608858,56782.0019,0:05:35,1722.228,Spinal Cord Injury Water Rescue! | Coast Guard Florida | Full Episode,14-Aug-20,2553,44232,17259.3384
12/28/23,501345,61102.9239,0:07:18,1893.542,Car Jackers | NightGuard Security Season 1 Episode 11 | Full Episode,13-Dec-20,2619,44165,12956.1608
12/27/23,444862,44834.2783,0:06:02,1340.464,Meth Head Investigated by Agents | Border Security: Canada's Front Line,7-May-22,1301,43896,10333.3869
12/26/23,385108,40999.244,0:06:23,1350.526,Saving Sailors in the Water | Coast Guard PNW - Cape Disappointment Pacific Northwest | Full Episode,4-Sep-20,2553,43550,15251.661
12/25/23,490137,35130.3249,0:04:18,1193.754,Armed Manhunt! | Coast Guard Cape Disappointment Pacific Northwest | Full Episode,18-Sep-20,2553,43450,12786.4848
12/24/23,773854,37699.6191,0:02:55,1210.902,Texas military man arrested at Canadian border #texas #canada #bordersecurity #dangertv,11-Feb-23,27,43404,333.9192
12/23/23,935495,41306.9915,0:02:38,1381.864,Illegal Duck Eggs?Ê | Border Security: Australia's Front Line,7-Aug-22,1330,43271,11259.1694
12/22/23,875492,44604.4713,0:03:03,1671.684,Laptop Full of Drugs - Border Security Australia,17-Oct-24,1381,43248,9611.9358
12/21/23,877026,51639.9431,0:03:31,2066.225,UK Border Agency Finds Loads of Hidden Cash! | Border Patrol,4-Dec-19,1381,43040,8207.0419
12/20/23,471502,42449.8725,0:05:24,1756.259,Merry Bust-Mas! - Border Security Australia - DangerTV,16-Sep-24,7007,43004,30636.9598
12/19/23,304275,42847.8217,0:08:26,1761.423,Culture Clash - Border Security Australia,3-Nov-24,1385,42628,10512.9995
12/18/23,240675,41967.7937,0:10:27,1779.763,Coke Mules Gone Wild! | Border Security: Australia's Front Line,16-May-24,1381,42410,7557.2696
12/17/23,236393,44326.9808,0:11:15,1807.337,Beetles and Butterflies | Border Security: Canada's Front Line,5-Dec-22,1306,42294,10892.5601
12/16/23,220047,39666.696,0:10:48,1581.127,"Dragging ""The Agulhas"" Container Ship Wreck | The Salvage Masters",12-May-23,2645,42280,9227.9785
12/15/23,235197,41875.7278,0:10:40,1912.624,Border Agents Make Uncomfortable Discovery at Gatwick Airport | UK Customs Border Patrol,31-Jul-19,1389,42236,5786.9762
12/14/23,237172,45876.8183,0:11:36,1993.224,Honduran Drug Runners | Border Security: Canada's Front Line,16-Apr-22,1311,42209,10405.8097
12/13/23,217239,40310.246,0:11:08,1868.81,What's in the Rug? - Border Security Australia,7-Oct-24,1400,42136,10189.997
12/12/23,209319,41200.2862,0:11:48,1819.654,Texas Jeff | Border Security: Australia's Front Line,22-Jul-22,1465,42035,12021.1096
12/11/23,208011,40757.3038,0:11:45,1710.418,Canadian Border Lies,28-Nov-23,40,41887,383.2657
12/10/23,250621,45499.5315,0:10:53,1732.643,Rookie Detector Dog Debuts | Border Security: Australia's Front Line,9-Nov-23,1271,41565,9189.0186
12/9/23,237267,45133.2391,0:11:24,1716.845,Corey Feldman Gets Detained at the Border | Border Security: Canada's Front Line,20-Mar-22,1311,41562,8558.0287
12/8/23,239750,47194.4528,0:11:48,2027.993,Big Interrogation Fail - Border Security Australia,25-Oct-24,1395,40999,8733.4811
12/7/23,277065,52113.8077,0:11:17,2309.227,Canadian Border Patrol tears apart trailer looking for handgun #bordersecurity,12-Apr-24,55,39998,477.0415
12/6/23,266431,48576.3881,0:10:56,2055.446,That's not my Bag - Border Dinner Broadcast,14-Oct-24,5736,39616,20940.13
12/5/23,255227,47168.3279,0:11:05,2013.495,Ex-Con Runs in to Trouble at Border | Border Security: Australia's Front Line,26-Mar-23,1263,39614,9771.3889
12/4/23,260492,47807.3819,0:11:00,2061.226,Drugs Hidden in Fish? | Border Security Australia,13-Sep-24,1400,39380,9590.9437
12/3/23,250567,44026.9272,0:10:32,1812.534,What is Diplomatic Immunity? - Border Security Australia,21-Nov-24,5513,39338,16630.3006
